owner_name,company,website,primary_contact_name,primary_contact_title,primary_contact_email,primary_contact_phone,linkedin_url,other_sf_properties,nyc_boston_presence,tandem_live_spaces,tandem_total_matches,tandem_signed_deals,notes
Ronaldo Cianciarulo,RJC Group,rjcgroup.com,Ronaldo Cianciarulo,Founder / Principal,rcianciarulo@yahoo.com,(415) 710-8269 / (415) 793-3200,linkedin.com/in/ronaldo-cianciarulo-6881781a,"933 20th St, 50 Quint St, 75 14th St, 111 Townsend, 600 20th St",None,0,0,0,"40+ yrs design-build; industrial/flex specialist; SoMa/Mission corridor; founder-operated — contact directly"
Trinity Management Services,Trinity Management Services,trinitysf.com,Sean Claybaugh,Business Development Manager,sean.claybaugh@trinitysf.com,,,"231-235 Post, 111-125 Maiden Ln, 1145 Market, 201-209 Post + ~4500 residential units",None,0,0,0,"Family-owned since 1949; FiDi/Downtown premium assets; 231 Post + 201-209 Post already published but not searchable — activation play; also try Darren Carrington (MD) darren.carrington@trinitysf.com"
Sunhill Corporation,Sunhill Corporation,,Hameed Faidi,President,hfaidi@sunhillcorporation.com,(415) 383-9100,,"850 Montgomery, 122 9th St, 665 Chestnut",None,1,3,0,"CA corp since 1981; Faidi Trust family structure; based Mill Valley; 850 Montgomery already live (04-29-26) — warm follow-up on 122 9th + 665 Chestnut; Zack Faidi is VP/Treasurer"
Victor Wu,J. Stella Inc.,jstella.com,Victor Wu,President,vicwu@jstella.com,(415) 397-0383,linkedin.com/in/victor-wu-977aa216,126-128 Post St only,None,1,14,0,"Core business fine jewelry wholesale since 1958; property appears owner-occupied showroom; 1 active match; Ron Wu (wusfterra@gmail.com) is secondary contact"
Martin Building Company,Martin Building Company,martinbuilding.com,Patrick McNerney,President,pmcnerney@martinbuilding.com,(415) 348-4460,,"855 Bryant, 2225 3rd St, 655 3rd St, 14 Mint Plz, 164 Townsend, 4 Clarence Pl; $220M Sutter St housing project",None,0,18,0,"Adaptive reuse specialist; 855 Bryant (10 matches) + 164 Townsend (8 matches) had history — reactivation play; 164 Townsend lapsed March 2025"
Archdiocese of San Francisco / RPSC,Real Property Support Corporation (RPSC),sfarch.org,Steve Kalpakoff,Director of Construction / Real Property,kalpakoffs@adsfrpsc.org,(415) 292-0800,linkedin.com/in/steve-kalpakoff-21313a70,360-368 Clementina + $6B+ nationwide portfolio managed via RPSC,National Archdiocese footprint (RPSC is SF-specific),1,4,0,"RPSC is non-profit RE arm; 360-368 Clementina just went live 05-12-26; institutional/slow-moving; approach as partnership not transaction"
James Schafer,Samuelson & Schafer Properties,samuelsonschafer.com,James Schafer,Owner / General Partner,jim@ssproperty.us,(415) 435-2983,,665 3rd St (Mission Bay Grade A 12-floor),Boston background (brokerage 1980s-90s) — current focus SF only,0,1,0,"100+ yrs collective experience; $500M+ development history; DB shows 655 3rd St suite 415 (confirm vs 665 3rd St); may have broker intermediary"
Geary-Market Investment Co Ltd,Geary-Market Investment Co Ltd,,Darcy Moch,CEO / Director,,(415) 955-0344 (SF) / (415) 457-3600 (San Rafael),,"49-55 Geary St only (Bankers Investment Building, 143733 sqft)",None,0,1,0,"Inc. 1956; 5-9 employees; 7 published spaces 0 searchable — clear activation opportunity; Yelp shows closed Dec 2025 but CA filings active — verify by phone first; also David Cuneo (CFO/Secretary)"
