city,neighborhood,address,total_spaces,published_spaces,searchable_spaces,avg_llm_score,owner_name,owner_website,owner_linkedin,boston_caveat,owner_size,classification_reason
New York,NYC - SOHO,75 Spring St,2,1,0,0.830,Greystone Management,https://www.greystonemgt.com/,https://www.linkedin.com/company/greystone-management-corporation/,,large,"Greystone Management has been a leader for nearly 40 years, manages millions of square feet of property throughout the tri-state area, and maintains a portfolio of approximately 1.5 million square feet, suggesting they own 50+ properties."
New York,NYC - Tribeca,412 Broadway,3,2,0,0.807,Milestone Equities,https://www.milestonegp.com/,https://www.linkedin.com/company/milestone-sales-and-lettings/,,large,"Milestone Equities identifies as a private real estate investment firm that has executed over $1 billion in real estate transactions and acquired/developed over 6 million square feet across the United States, indicating a large institutional investment fund or significant national developer."
New York,NYC - FIDI,7 World Trade Center,4,4,0,0.805,,,,,large,"Despite the owner name being unknown, 7 World Trade Center is an iconic, institutional-grade skyscraper in a prime global location, which necessitates ownership by a large institutional entity like a REIT or a major developer."
New York,NYC - SOHO,148 Lafayette St,1,1,0,0.800,Tishman Speyer,,,,large,"Tishman Speyer is a globally recognized institutional investment fund and a major real estate developer, explicitly fitting the definition of a large owner."
New York,NYC - Flatiron,11 Madison Ave,2,1,0,0.780,www.pgim.com,,,,large,"PGIM is the global asset management arm of Prudential Financial, a publicly traded company, and operates as a large institutional investment fund managing a significant global real estate portfolio."
